query_id,question,correct_document_id,rank
904,익명조합원은 어떠한 상황에 익명조합을 활용하여 돈을 벌 수 있는가?,37844,1
905,아델리펭귄 새끼들이 먹이를 달라고 칭얼거릴 때 무엇과 유사한 소리를 내는가?,36936,1
906,2007년 IAU에서 외계 행성과 갈색왜성을 구분하는 척도로 삼자고 제시한 것은?,43676,1
907,양운에 의해 역모 계획이 들통난 사람은?,50356,3
908,쯔웨는 SM엔터테인먼트에 누구의 영화 출연을 요구했나요?,38698,1
909,형사소송법 제361조의4 제1항에서 법적으로 보호하는 사람은?,11052,1
910,이탈리아 AC 밀란에 의해 3년 연달아 컵위너스컵을 달성하지 못한 국가는?,31124,1
911,헤위에르달이 실험을 한 이후에 이야기를 나눈 상대는?,6653,2
912,이용순이 서재필의 시신을 뒷수습할 당시 서명원이 머무르던 국가는?,32341,1
913,코시모는 누구로부터 교육을 받았나?,28799,1
914,이화곡 가루를 물과 쌀에 넣으면 무엇이 시작되나요?,52235,1
915,이사회에서는 회의를 한 해에 적어도 몇 개 진행하나?,7030,2
916,콘스탄티네 2세에 이어 왕위를 계승한 인물은 언제까지 군림하였나요?,28046,1
917,견갑골의 움직임에 집중한 훈련의 효과를 본 구종은?,47718,1
918,호라티우스가 아테네로 공부하러 가게되었던 해는?,4917,2
919,마이클 스펜스가 철학을 공부한 대학교는?,38782,1
920,조프루아가 여러 학자들이 발표한 동물 구조의 유사성 개념을 참고해 만든 논문은?,33421,1
921,1963년 제 5대 대통령 선거 후보로 확정된 인물은?,7442,17
922,《애시스 투 애시스》에서 앨릭스 드레이크를 총으로 쏜 인물은?,50281,1
923,역의 동쪽 일부에서 토지 구획 정리 사업을 주관하는 도시는?,47402,1
924,머리광배에 특이하게 불꽃무늬나 연꽃무늬를 각인하는 특징을 가진 나라는?,36115,21
925,인터넷과 휴대전화의 보급 전 주로 사용되던 물리적 매체는?,7326,2
926,술을 계속 찾도록 유도하며 알코올의 영향을 받는 것은?,17428,2
927,크로마토 그래피 카트리지가 한 번에 사용 가능한 샘플의 수는?,53185,1
928,학자들이 슬라브조어를 위해 사용한 외국의 언어는 무엇인가요?,57993,1
929,아리스타르코스가 처음으로 지동설을 이야기했지만 이를 반박한 인물은?,4951,3
930,1897년 민영환이 영국공사로 갔을 당시 영국은 누가 다스리고 있었나요?,53109,1
931,타스만 호수에서 흐르는 물은 타스 강을 거쳐 어느 호수로 흘러가나?,27222,1
932,경찰관은 김씨를 누구라고 생각했는가?,27170,2
933,메데이아가 화가 난 이유는 무엇인가?,12201,3
934,히키코모리에 대한 별 관심을 두지 않았던 때는?,9464,1
935,포도주 블라인드 테스트를 소재로 만든 영화의 제목은?,46047,1
936,매니저가 사실이 아닌 내용이라며 해명서를 발표했던 방송은 무엇인가?,12736,1
937,유럽 연합군 최고사령부가 출범한 것은 몇년도인가?,4890,5
938,이반 T.굿맨 다음으로 샌피드로 산 미라를 보유한 사람은?,40502,1
939,2002년 9월 22일에 시행된 독일 총선거에서 뽑고자 했던 연방의회 의원 수는?,40138,1
940,브루노와 부팔마코가 칼란드리노의 여정에 함께한 이유는?,25412,1
941,경성일보에 담화문을 발표한 자는 종교계 사람들을 무엇이라고 나무랐는가?,8512,2
942,페르디난도 2세는 언제 사망했나?,28765,21
943,가미요시다의 국도 139호 인근에 많아진 것은 무엇인가?,9281,1
944,제2대 주일 미국 공사가 일본에서 세운 가장 큰 업적은 무엇인가?,42151,1
945,한국 대 멕시코 경기에서 선제골을 넣은 쪽은?,51777,1
946,시에라 네바다 산맥에서 할 수 있는 스포츠는?,29144,1
947,진화론을 다룬 학파 중 기형의 역할을 중시한 학파는?,33424,3
948,오래된 족자는 어디에 진열되어 있었나?,39062,21
949,나기브에게 가택연금 처분을 내린 자는?,39989,2
950,저고리의 길이가 짧아진 시기는 언제부터인가?,16451,9
951,스페인의 기독교인들과 성관계를 하게 될 시 위험해지는 사람들은?,48606,1
952,케냐를 부패하게 만들고 본인도 국가의 대지주로 만든 케냐타의 정책은?,6204,2
953,맥다월의 군대가 후방에 남아서 방어해야 하는 도시는?,15993,1
954,몽칼름과 보드레이유가 지휘 문제로 서로 갈등하기 시작한 것은 몇 년인가?,49236,2
955,1987년 일본 시리즈 우승팀을 지도한 감독은?,41459,21
956,매그니토가 나온 장면의 대부분을 연기한 배우는?,37989,1
957,록키에게 재시합을 신청한 사람은?,31666,1
958,"카리용 전투에서 영국 육군이 조지 호수 해안에 상륙했을 때, 그곳에 방치되어 있던 물자와 무기는 어느 나라 군대의 것이었나?",34582,1
959,10월 3일까지 오키나와 방면에서 유일하게 공격받은 곳은?,41425,1
960,포켓몬 바크 경기가 진행되는 장소는?,22450,1
961,거북산이라 불리는 산의 명칭은?,21397,2
962,미주리 타협을 무효로 하는 법은?,20114,3
963,랑페르 드 브르트니에르가 1858년에 다녔던 학교는?,39598,1
964,에우포르보스와 아폴론이 함께 공격했던 인물은?,19469,1
965,동탑은 탑신 몇 층으로 구성되어있나?,34451,1
966,2018년 당시 보이저호의 위치는?,50108,21
967,사수도의 해안선은 대부분 무엇으로 구성되어 있나요?,33093,1
968,장 전 총리가 한 행동을 두둔해준 사람의 이름은?,6956,2
969,냉전 이후 여러 분야에서 상대적 발전을 지속한 시대를 일컫는 용어는?,52295,1
970,동투르키스탄을 식민지로 삼아야 한다고 주장한 사람은?,55774,1
971,광해군이 나라를 통치할 당시에 주도권을 가지고 있던 파는?,13460,21
972,이호민이 과거시험에 합격한 것은 몇년도인가?,39314,3
973,주민들의 대피를 도왔던 사람의 이름은 무엇인가요?,56191,21
974,알하킴이 후세인의 정치 권력을 없애기 위해 만든 조직의 이름은?,7389,8
975,박재완이 금자탑을 세운 해는?,45730,1
976,도스토옙스키는 젊었을 때 어떤 사상을 추구하는 정치 클럽에 참여하였나?,8236,3
977,순무 제도가 생긴 것은 언제인가?,28351,1
978,미국으로 이민 온 사람들은 누구로부터 돈을 차용할 수 있었나?,40872,3
979,종교적 목적으로 파리 대학교에 교황이 세운 교육 기관은?,6760,21
980,신자가 편의점에서 잡은 남자는 몸 어디에 문신이 있나?,35923,1
981,뮤지얼보다 더 높은 점수로 경기를 그만 둔 인물은?,18901,1
982,《나니아 연대기》시리즈 중 시간 설정이 가장 먼저인 작품의 이름은?,59584,2
983,삼손의 약혼녀였던 사람의 아버지 이름은?,60242,1
984,김원치 검사와 이흥구가 재회하여 이야기를 나누었던 시간은?,57479,1
985,일본인들에게 송도고보는 일본의 어느 학교보다 더 크다고 소문났나?,5321,4
986,황국의용군의 지도자는?,27142,1
987,나라에서 군인들을 뽑아 만든 군대를 통솔하는 우두머리는 누구인가?,40859,21
988,사이버펑크에 주로 등장하는 시간적 공간적 배경은?,11865,4
989,피부세포를 다른 조직으로 전환시키는 기술보다 안전성 측면이 취약한 기술은 무엇인가?,58283,2
990,미하일 무루초스는 태권도가 정식 종목이 된 올림픽에 참가하기 위해 어디에서 예선전을 치뤘는가?,44103,21
991,"인류의 발전에 있어, 인류의 머리가 커지기 전에 일어난 일은 무엇인가?",28423,1
992,타란티노의 영화에서 자주 들을 수 있는 음악 장르는?,23144,1
993,훗날 나오마사가 된 인물이 당주가 되었을 당시 나이는?,41382,1
994,불경에 악평을 쏟아 궁예가 직접 살해한 승려는?,7962,2
995,보살상의 최상단에는 무엇이 그려져있는가?,40374,21
996,윤치호가 일부 독립운동 지도자들로부터 비난 받았던 일기의 내용은?,5307,2
997,보좌관이 아닌데 보좌관으로 불리는 요원들의 별명은?,33354,1
998,오다와라의 다수의 건물이 붕괴된 원인은?,22651,1
999,사회적으로 은둔하며 외톨이 생활을 하는 사람을 부르는 명칭은?,55107,21
1000,닉슨 행정부가 베트남 전쟁에서 옹호했던 편은 어디인가?,39058,1
1001,대부분의 마약은 멕시코를 거쳐 어디로 운반되었는가?,32386,2
1002,이민곤에게 유배령을 거둬들이고 벼슬과 영정을 내린 왕은?,52777,1
1003,트리에르바일레르가 지속적으로 일을 해야 하는 이유는 무엇인가?,31557,1
1004,마라도나는 어느 나라 선수인가?,7088,2
1005,미국이 베트남에서 철군한 이후 사이공을 장악한 세력은?,8190,2
1006,마리가 사망할 당시 그녀의 나이는?,10752,2
1007,지방지 중 전국지와 크게 다를 것이 없는 것은?,7712,2
1008,소영의 나이는 몇 살인가?,43685,1
1009,간결과의 토론 후 진중권은 누구로부터 토론을 제안받았는가?,35704,1
1010,천장욱이 귀국 후 처음으로 군수직을 맡은 곳은 어디인가?,13889,1
1011,미국의 고용시장은 어느나라로 생산 라인이 크게 옮겨지며 감소하게 되었나?,4712,5
1012,아타속이 먹는 균이 길러지는 곳은?,25662,1
1013,민영익의 한쪽 눈을 찔러 기습공격을 감행한 인물은?,35833,2
1014,신식 전술 중 보병의 진군에 방해가 된 것은?,5509,2
1015,일 년전쟁에서 결과적으로 이긴 부대는?,7842,21
1016,해방 정국에서 각 정치세력이 유일하게 합의를 이룬 해는 언제인가?,5599,2
1017,중세시대에 가장 이름을 날렸던 타이빈성 출신 문학가는?,22830,1
1018,시간과 공간이 서로 영향을 주고 받는다고 주장한 학자는?,6284,3
1019,일반적인 성작은 무엇으로 만들어지나요?,29882,1
1020,형재 프랭크퍼트 지역에 처음 발을 딛은 백인은?,10512,1
1021,자유심증주의가 법관의 판단을 절대적으로 신뢰한다는 것이 드러나는 조항은?,17818,1
1022,서복영의 남편이 태어난 도시는?,31749,21
1023,치아표면을 상하게 하는 산은 세균이 무엇을 분해시키면서 발생하는가?,22791,1
1024,크렘린 궁 석벽의 현재 용도는?,5915,2
1025,댈러스 이전에 부통령직 지위를 제안받은 인물은 누구인가요?,27402,1
1026,아일랜드 명칭의 유래가 된 사람의 아버지는?,35162,11
1027,어떤 성분을 많이 넣어야 도자기의 처음 성형했을 때와 구워 냈을때의 형태가 별로 달라지지 않는가?,13784,1
1028,유란시아의 원본은 어떤 언어를 사용하였나?,15853,21
1029,공장들이 방향을 수익 중심으로 잡게한 제도는?,58792,7
1030,청자 상감국화모란유로죽문 매병에서 꽃봉오리 같은 부분은 어떤 모양으로 다듬어져있나요?,36729,1
1031,한나라당이 댓글 관리를 처음 시작한 해는?,4781,2
1032,불암산 호랑이 유격대의 마지막 유격전은 어떤 군대의 수송대를 공격하는 작전이었나요?,56191,1
1033,일본 오야마 역과 신마에바시 역을 잇는 여객철도 노선의 개통 당시 본래의 기능은 무엇이었나?,27435,1
1034,2011년 크리스마스에 열린 대부분의 축구 시합에서 내국 병사는 누구를 상대했는가?,7781,2
1035,임진왜란의 정전회담의 결렬로 다시 일어난 전쟁은?,38171,21
1036,성종이 왕위에 오르기 전 장순왕후의 신분은?,16346,1
1037,"탐색을 시작할 때, 제일 먼저 설치해야 하는 것은 무엇인가?",20721,1
1038,G급 순양전함에 쓰이는 대포의 둘레 길이는?,13025,1
1039,"지드래곤은 ""One Of A Kind""로 얼마만에 솔로로 무대에 복귀하는가?",42496,2
1040,김순명은 무엇에 의해 사망했나요?,48494,21
1041,"알렉세이 나발니가 혼수상태였을 당시, 비행기는 어디로 향하고 있었나요?",49611,1
1042,흉노를 공격하려는 계획에 상반된 의견을 가진 자는?,52473,21
1043,마이크로소프트사 윈도우의 시장 점유율이 줄어들기 시작한 해는?,21909,1
1044,이스트앵글리아 왕국의 초기역사에 대한 자료인 <교회사>의 저자는?,19310,2
1045,땅꾼자리 제타의 최대 크기는 무엇보다 큰가?,15413,1
1046,루터가 교육의 장으로 가장 강조한 곳은 어디인가?,31364,1
1047,초기 출혈성 천연두의 주된 사망 원인은 무엇인가?,5541,4
1048,도스토옙스키의 작품에 담긴 기독교 사상은 무엇에 기반한 것인가?,8238,2
1049,인정식이 입지를 넓히는데 걸림돌이 된 그의 사상은?,14027,1
1050,윤치호는 서재필을 찾아간 후 어느 지역으로 갔나?,5282,8
1051,국부가 담겨있는 항아리 뚜껑에는 무엇이 적혀있나?,8638,2
1052,남대문 전투의 시발점이 된 사건은?,11499,21
1053,카라만리는 누구에게 맘루크 칼을 하사했나요?,36471,1
1054,의존성을 사용하려는 객체는 무엇을 호출할 수 없나요?,31856,1
1055,2005년에 맨체스터 유나이티드의 구단 경영권을 얻은 인물은?,44349,1
1056,대내림'을 행한 뒤 다음 순서는?,37217,1
1057,에포케의 이유를 제시한 책은?,44693,21
1058,여성들이 입대할 수 있는 세력은?,20870,21
1059,가끔씩 북동부 지역에 살고있는 오리너구리들을 사냥하는 포식자는 누구인가?,7731,2
1060,정녀 7명 중 한 명을 모시고 간 집안은?,47214,2
1061,노르망디 침공이 시작된 년도는 언제인가요?,39292,7
1062,아즈텍 문명을 침략한 나라는?,12973,1
1063,인격이 달라질 때 그 전의 기억을 잊어버리는 질환은 무엇인가요?,48941,1
1064,미이라를 활용해 많은 의학적 지식을 얻은 것은 누구인가?,50719,3
1065,고속국도법이 철폐되어 어떤 법에 속하게 되었나?,6427,2
1066,영화《제일하우스 록》을 연출한 사람은 누구인가요?,47441,1
1067,프랭크 베이커의 반환을 거부한 사람은 누구인가?,35777,1
1068,임시발병규정에서 채택된 군사는 무엇에 능력이 뛰어난가?,48504,1
1069,피해자들의 탈출을 막기위해 보닌이 운전석 문을 제외한 다른 문에서 모두 없애버린 것은?,60334,1
1070,아카풀코에 새로운 열대 요란이 일어난 날짜는 언제인가요?,31733,1
1071,역사상 가장 오랫동안 이용된 용광로는?,53538,21
1072,"미국과 영국, 소련의 외교적 대표들의 논의가 이루어진 자리는 무엇인가?",26835,21
1073,윤치호가 조지아주에서 재입학한 학교는?,5281,2
1074,리위안훙이 총통 자리에 있을 때 베이징에서 쿠데타를 일으킨 사람은 누구인가?,6194,2
1075,송세호를 극동을 관리했던 사업가로 기사를 냈던 곳은 어디인가?,54736,1
1076,제천시가 시내버스에 LED 행선지표지판을 설치하기 시작한 해는?,21354,1
1077,볼러의 능력을 판단할 수 있는 기준은?,24200,1
1078,2007년 자유 지수 순위 참여 국가 중 꼴찌를 한 국가는?,16593,1
1079,밀본을 얕잡아 본 인물은 누구의 친구였나요?,18910,1
1080,태평양 전쟁 당시 필리핀에 진격하기로 한 사람은?,41248,3
1081,3년간 레논이 부인과 떨어져 지낸 시기를 뜻하는 말은?,51397,5
1082,크리스마스 정전을 더이상 볼 수 없게 된 해는 언제인가?,7777,4
1083,1816년에 구제동맹을 만든 사람들은?,22377,4
1084,앙리의 부인은 누구의 후손인가?,7222,15
1085,12월 8일 기습 공격을 행한 군대는?,4878,21
1086,티타노케라톱스가 펜타케라톱스보다 더 유사한 종은?,24464,2
1087,네메스는 보통 누가 사용하던 물건인가?,47020,21
1088,더듬이의 곤봉의 분절이 2개인 개미는?,50887,1
1089,포츠머스 조약에 따라 일본이 러시아로부터 받아낸 것은?,27657,1
1090,도차기현 남서부에서 군마현 남동부까지의 평야 도시들을 연결하는 노선은 현재 주로 어떤 역할을 하는가?,27435,1
1091,윤치오가 특파대사직에 고용된 것을 막으려한 나라는?,5286,4
1092,766부대의 본부는 북한의 어디에 있나요?,58876,1
1093,수십 년 동안 아카디아 주민들에게 충성 맹세를 받기 위해 매진했던 국가는?,49172,1
1094,하나님을 대신해서 새 언약을 세운 주체는?,48730,3
1095,일본에서 환상게임 애니메이션 TV 시리즈를 약 1년간 방영했던 방송사의 이름은?,7644,7
1096,6월 28일에 북한은 어디를 점거하였는가?,49640,21
1097,티무르 다음으로 바그다드를 다스리게 된 사람은?,13635,1
1098,이규완은 고종 황제를 폐위시킨 이후에 누구를 올리려고 했나요?,9921,1
1099,포켓몬의 종은 총 몇 개인가?,14571,5
1100,한왕은 항우에게서 누구를 빼앗아 자기 편으로 만들려고 했나요?,31786,1
1101,헨리가 리처드를 언덕 아래로 유인하기 위해 타격에 쓴 무기는?,16687,1
1102,스트라디바리우스 악기에 사용된 밀도 높은 단풍나무의 원산지는?,6091,2
1103,육아 적응력이 떨어져 아이들을 방임한 인물은?,58941,1
1104,래드왈드 왕이 죽고난 뒤 그가 다스리던 지역은 어떤 왕국이 통치하게 되었나?,19308,2
1105,왕정이 끝난 뒤 네팔 공산당이 국회에서 차지한 자리의 개수는?,16711,1
1106,함경 방언에 영향을 받은 말들은 어디에서도 쓰이나요?,11330,1
1107,식량이 부족한 시기를 어떻게 표현하는가?,21365,21
1108,일본의 전투기법을 연구하며 중국 군사고문으로서의 역할을 수행한 사람은?,22574,2
1109,고려 태조가 즉위한 곳은 이전에 누가 자리를 잡았던 곳인가요?,5171,21
1110,맥헨리가 육군 장관 자리에 오른 해는?,36375,1
1111,압델 파타 엘시시 이전 이집트 대통령은?,41091,1
1112,로제르에게 안티오키아가 적으로부터 안전한 이유를 전한 사람은?,17173,1
1113,킹을 구하기 위해 그의 아버지가 사용한 기술은?,21588,21
1114,루돌프는 누구 다음으로 죽었는가?,4929,21
1115,방실이가 미군 부대에서 처음으로 활동하기 시작한 해는?,12840,1
1116,미국이 베트남의 정부에 간섭할 수 있게 만든 사건은?,58918,21
1117,밀월 관계로써 미국이 지속적으로 보급하고 있던 것은?,23916,1
1118,17세기 식민지 정착민들이 메이플 시럽 대신 단 맛을 내는데 사용한 것은?,40996,1
1119,고려에 대성아악을 전파한 사람은?,7304,2
1120,헥토르의 부인을 노예로 부렸던 인물은?,33626,1
1121,종자식물의 분지는 무엇이 자란 것인가?,25892,1
1122,프로 베르첼리의 별명은?,60075,1
1123,1854년 미국이 일본과 수교를 하면서 맺은 조약은?,23915,2
1124,티칼에게서 마야의 중심 도시라는 명성을 뺏은 도시는?,12182,1
1125,우찬의 데뷔골 덕분에 페네르바흐체가 얻은 것은 무엇인가?,38464,1
1126,일본의 직선기선 인정요구로 인한 EEZ의 경계는?,5348,2
1127,근대적 대기업은 무엇을 야기하였나?,43550,1
1128,아인이 옥림과 헤어진 이유는?,8950,2
1129,접시 돌리기를 보여준 등장인물은 무슨 동물인가요?,48106,1
1130,코알라는 하루에 최대 얼마 정도의 수면을 취하는가?,5366,6
1131,그리스의 군대를 막기 위해 열강들이 막아버린 지역은?,22887,15
1132,글리세르알데하이드 3-인산이 생성되는 반응은?,56837,2
1133,토미 도허티의 지도 아래 첼시 선수들은 무슨 색 양말을 신게 되었는가?,9844,1
1134,신라시대에 만들어진 작품이라고 추측하는 근거는?,43123,21
1135,예성강 입구에서 대전차포에 피격당한 부대는?,44205,1
1136,니시노미야 이서에서 급행 정기 운행은 언제까지 했나?,30633,1
1137,누구와의 만남이 매사추세츠 족에게는 불행이었는가?,34757,1
1138,제호퍼가 바이에른주 총리직을 죄더한테 넘긴 해는?,60160,1
1139,오버월드의 레벨 제한을 풀기 위해서 플레이어는 능숙도와 완수도에서 어떤 티어를 달성해야 하는가?,57244,1
1140,미시시피 주에서 미시시피 강과 만나는 강은?,36012,1
1141,"의결권 없는 주식을 뺀 발행주식총수에서, 주주가 주식 몇 개를 보유해야 초과 주식에 대해 의사를 표명하지 못하게 되는가?",25212,4
1142,두위밍을 불러 들인 사람은?,45109,1
1143,2014년 박근혜 대통령이 '한반도 평화통일을 위한 구상'을 주제로 한 연설문은 무엇으로 명명되었는가?,33522,1
1144,SS 소속 군인 중 영국 제1 공수 여단 2대대와 교전한 인물은 누구인가?,8406,2
1145,송진우가 윤치호를 찾아온 날은?,5306,6
1146,Presocratics'는 어느 나라 말에서 비롯된 단어인가?,4926,21
1147,노르웨이 사절단이 스웨덴 왕녀를 요구한 것은 언제인가?,50599,3
1148,파르네제가 엘프헬름으로 가기 위해 탄 배의 이름은?,57597,1
1149,돈 봉투를 건네주라고 명령한 사람으로 의심 받은 사람은 누구인가?,30495,1
1150,우르바노 5세가 일시적으로 설립을 허용한 대학교는?,6772,2
1151,인공호흡기에 쓰이는 에너지는 무엇을 통하여 압력을 만들어내나요?,30393,1
1152,트롱트낵 요새는 어느 나라가 사용하는 요새인가?,49446,1
1153,금동신묘명삼존불은 어떤 양식으로 만들어졌는가?,34145,2
1154,국가가 군인 징병시 주민을 찾아 군복무에 적합한지를 파악하는데 필요한 것은?,40859,1
1155,반 아이들에게 세리가 누구를 좋아한다고 들통났나요?,8950,2
1156,2010년 기준으로 유럽 평의회 의원 회의 특별 참가국이 아닌 나라는 어디인가?,17580,1
1157,영화 네파리우스: 머천트 오브 소울스의 유통사는?,49134,1
1158,아뇨나가 두 번째 해외 진출을 한 해는?,42756,1
1159,프라이드 하우스는 누구에 의해 처음 설치되었는가?,39874,1
1160,넬리 킴이 경기에서 은메달을 획득한 종목은 무엇인가?,11982,1
1161,윤치호가 서양인을 높게 평가하면서 사용한 단어는?,5288,8
1162,IPTV가입자가 특정 방송 채널을 시청하기 위해 필요한 장비는 무엇인가?,42521,1
1163,빌리가 정글짐에서 떨어져서 부상당한 부위는?,31314,1
1164,1979년 일본시리즈 우승팀은?,41406,21
1165,존스 일행은 살인 장면을 보고 범인을 쫒을 때 무엇을 타고 이동하는가?,38441,4
1166,내트 터너는 어디 출신인가?,6173,2
1167,1989년 당시 티베트는 어느 나라에게 통제를 받고 있었나요?,54762,1
1168,오이 샌드위치를 처음 만들기 시작한 국가는?,30574,1
1169,아이스크림과 우유를 하나의 음료로 혼합하기 위해 사용하는 컵의 재질은?,17389,1
1170,일부 노선이 어번 네트워크 구역에 소속되지 않았던 해는?,19437,1
1171,윤치호는 어떤 인물의 통역을 맡았나요?,5289,4
1172,마우리츠가 자신의 정적을 제거한 것은 몇 년인가?,20760,1
1173,제니가 아장에 의해 장애를 가지게 된 신체 부위는 어디인가?,28730,3
1174,원숭이들이 도구를 사용하여 견과류를 얻는 모습을 보고 알 수 있는 학습행동은 무엇과 가장 연계되나?,50707,1
1175,아서를 낳은사람의 남편은?,10448,21
1176,문제가 사망한 뒤 왕이 된 사람은 누구인가?,40831,21
1177,스바프를라미는 누구의 손자인가?,39564,1
1178,일제강점기 당시 조선 지식인들이 일본 정부에게 일본인과 동등한 권리를 요구하는 계기가 된 사건은?,9927,1
1179,타티키오스는 1097년에 십자군들을 돕기 위해 어디로 갔나요?,28469,1
1180,조쉬마자의 이적 이후 그의 역할을 대신한 인물은?,60227,1
1181,대한민국에 농구가 처음 상륙한 해는?,4967,2
1182,협동조합당의 근간 역할을 하는 단체는?,44457,1
1183,피츠로이는 항해 중 누구의 생각을 받아들이고 있었나?,26995,1
1184,1949년 8월 6일에 북한군을 발견한 뒤 무찔렀던 연대는?,15328,12
1185,이언 캐머런의 아내가 매킨지 앤드 컴퍼니의 국제 경영 상담자로 일하기 시작한 년도는?,39339,1
1186,오브스테트릭스의 뜻에 대해 연구한 사람은?,48037,1
1187,스페인이 영국에 빼앗겼다가 다시 차지한 지역은?,20326,6
1188,현대 사회에서 전쟁의 궁극적인 목적으로 보는 것은?,20507,4
1189,17세기 이전 베이크드 빈즈는 어떤 콩으로 만들었는가?,40996,1
1190,경상도가 만들어질 떄 중점이 되었던 곳은?,15568,21
1191,비트겐슈타인이 소피야 야노프스카야를 만났던 연도는?,4935,2
1192,공하류의 무서운 새우라는 의미는 어떤 동물 종류의 외형에서 따온 것인가?,37850,1
1193,송상현의 위패가 있는 절은?,52674,1
1194,"아물레흐티에서 ""최저의 인간쓰레기""라고 지칭한 사람들은?",46210,1
1195,디오게네스는 누구에 의해 죽임을 당했나요?,59761,20
1196,하이든의 <천지창조>에 영향을 준 것은?,5403,2
1197,S/W 취약점 찾기 대회에서 수상한 해커그룹들이 찾은 보안 취약점의 특징은?,20281,1
1198,기원전 234년에 진나라는 어디를 다시 침략하기로 하였나요?,5866,7
1199,전북 남원과 전남 나주가 특별 재난 지역으로 지정된 것은 언제인가?,59437,21
