query_id,question,correct_document_id,rank
2996,시민주의적 성향을 보인 정기 간행물은 무엇인가?,20031,21
2997,용화사 내부의 오른쪽에 있는 작은 바위에서 누가 자주 기도하나?,48514,1
2998,벨기에는 어느 전쟁에서 패배하여 독일군에 의해 요새를 잃게 되었나요?,8823,2
2999,브르너는 카롤루스 마르텔루스가 교회 토지를 빼앗아 어떤 군인을 키우려 했다고 주장했나?,47799,1
3000,젊어서부터 군대에서 두각을 나타낸 사람은?,11145,1
3001,스밀레츠는 어느 나라의 간섭에 의해 황제가 되었는가?,36919,1
3002,오자와가 핼시를 꾀어내기 위해 손실을 감수한 것은?,16963,1
3003,네덜란드 국가대표팀에서 가장 많은 골을 넣은 선수는?,7059,21
3004,후고의 추대에 도움을 줬다는 의심을 사 바벤베르크에게 공격받은 사람은?,59579,1
3005,오스만 제국의 황제가 누구한테 권위를 행사하기 위해 칼리파권을 양위받았나?,6646,2
3006,레닌의 선봉대로 러시아 제국을 완벽히 무너뜨린 단체는?,5765,12
3007,위험중립 측도에서의 적정가격이 실제로 사용될 수 있게 하는 것은?,29428,1
3008,세균은 사람의 몸속에 들어올 때 어디로 들어오나?,57963,1
3009,"면역력이 약한 환자의 경우, 항생제 치료법 효과가 미미할 수 있는 원인은 무엇인가?",58089,1
3010,2014년 7월 14일 이후로 고속도로 노선을 지정하는 주체는?,6427,2
3011,김조원이 청와대 민정수석이 되는 것을 반대한 사람은?,54552,1
3012,루체왕국은 아시아지역의 몇 개의 거점이 연합해서 만들어졌나?,34132,1
3013,일본에서 지진 피해를 입지 않은 건물은 무엇인가?,58582,1
3014,조지아 식민지의 칙허장을 발급받은 자가 금지했던 제도는?,34503,1
3015,플레이어가 이길 승산이 있는지 예측할 수 있는 문서는?,40848,4
3016,후두의 영어표현은 누구에게서 비롯된 것인가?,26472,16
3017,황금 양을 가지면 왕이 되어야 한다는 티에스테스의 의견에 동의한 인물은?,32961,1
3018,보속은 어떤 종교에서 속죄 행위라는 의미로 쓰이나요?,29125,1
3019,그림 형제가 《소년의 마적》에 영향을 받아 출간한 서적은?,6820,2
3020,윈스턴 처칠 총리 이전의 보수당 총리는?,37249,1
3021,현재 사용되는 가타카나를 체계화한 법규가 발표된 해는?,4591,3
3022,엘디아의 초대 황제라고 알려졌던 사람을 노예로 부리던 사람은 누구인가?,55151,1
3023,이중로의 얼굴 그림에서 옷 테두리와 같은 색으로 그린 부분은?,37146,6
3024,압둘라의 아버지를 죽게한 병 이름은?,19922,21
3025,이보 안드리치가 시집 <알리야 제르젤레즈의 여행>을 발표한 해는 언제인가?,18389,1
3026,《볼티모어 선》지에서 피닉스와 위더스푼을 호평한 사람은?,17210,1
3027,프티 부르주아적 급진주의'의 형성 가능성이 있는 계층은?,7377,1
3028,"농업과 목춥업 등이 구축되는 근원이며, 생산력의 근간은?",5310,21
3029,액운공사에 대한 설명이 나와있는 저서는?,12404,1
3030,1999년에서 2004년까지 비타민 A 보충으로 목숨을 건진 사람은 대략 몇 명인가?,48501,1
3031,미국 국내 노동 관계법의 별칭은?,59364,1
3032,오카야마 공습 전후로 국도 주변에 형성된 것은 무엇인가?,22915,4
3033,마르코스 정권이 공항에서 암살한 필리핀 야당 지도자는?,6856,4
3034,클린턴은 1996년 재선에서 누구를 꺾고 선거를 이겼나요?,4633,2
3035,루카시의 아들이 태어난 곳은?,18898,21
3036,토리노 조약을 맺은 년도는?,7676,2
3037,이광의 할아버지는 누구인가?,44284,15
3038,갈릴레이는 무엇을 이오와 동일한 천체로 생각했나요?,8264,2
3039,1930년대 초중반에 전수린과 함께 작곡가로 쌍두마차를 이룬 사람은?,16132,1
3040,윤치호가 독립운동에의 참여를 등한시하기 시작한 해는?,5305,11
3041,다수의 태국 왕들이 승려로 임명되었던 절은 어디인가요?,55357,21
3042,네브카드네자르 2세의 부인은?,10243,1
3043,삼성이 더이상 한겨레를 광고하지 않는 까닭은?,20939,1
3044,고쿠데라의 머리 모양에 영향을 준 것으로 추정되는 사람은?,27789,21
3045,카자크의 소통 언어는?,19405,1
3046,임선규의 작품이 처음으로 공연한 극장은?,11440,21
3047,1978년 콘클라베의 승자는?,29305,2
3048,프로그램 관리자 역할을 시작 메뉴가 맡았던 최초 버전은?,11390,1
3049,진승현이 각종 불법 행위를 통해 만든 것은?,22345,1
3050,이사회에 가입되어있는 회원국 수는?,7030,7
3051,로그 혁명 사건의 주도 세력은?,58983,1
3052,오스만 튀르크의 영토가 축소된 원인은?,5523,15
3053,찰스 도우슨에게 유골의 파편을 준 것은 누구라고 했나?,28419,2
3054,루움 전쟁에서 에이스 부대로 활약했던 집단은?,7831,2
3055,유상이 사용한 약 중 스님과 관련된 약은 무엇인가?,15654,1
3056,이규완은 무엇을 발전시켜야 사회의 발전과 문명화를 이룰 수 있다고 했나?,9935,1
3057,트로이아 목마 반입에 반대한 예언자는?,48415,1
3058,<우순소리>를 금지시킨 제도는?,5304,21
3059,진나라에 복종하려 했지만 대부들의 저항이 심했던 나라는?,34230,3
3060,코치슈가 음악 감독을 그만둔 건 언제인가?,15538,1
3061,행복추구권의 줄이지 않은 원래 용어는?,54697,21
3062,수고당에 보존되어 있는 의류는 누구의 것인가?,55628,1
3063,사지 일가가 오노 성을 다스리기 이전에 군림하던 일가는 어디인가?,18682,4
3064,"북극의 얼음층에 서식하며, 북극곰의 주식이 되는 동물은?",8023,2
3065,신체에 령주를 새긴 마술사는 몇 명인가?,8036,2
3066,경찰들의 주장이 거짓이라는 증거가 된 물건은?,58503,21
3067,베트남의 남북을 갈라지게 만든 군사 분계선이 위치한 곳은?,57250,2
3068,황제 즉위 초반부터 농업 발전에 엄청난 공을 들인 인물은?,57049,21
3069,시칠리아 지원군은 어느 세력을 돕기 위해 오는가?,48172,13
3070,13살 때 아버지가 죽은 인물이 태어났던 해는?,39269,21
3071,사건 관련자가 이홍기가 아니라 이종현임을 밝힌 언론사는?,25248,1
3072,손일은 본인이 기습 공격 대상이 된 것을 알아챈 후 어디로 도망갔나?,27471,21
3073,이란에서 쿠데타를 시도한 당이 만들어진 연도는?,47825,2
3074,필리핀 1페소는 원화로 얼마 정도 하는가?,59990,2
3075,장씨의 항소심이 열린 곳은?,38524,1
3076,카리용 요새가 만들어지는데 요인을 제공한 나라는?,34578,1
3077,류리크 왕조가 세워진 이후 카간이라는 명칭은 무엇으로 바뀌어갔나?,24101,1
3078,여운형이 직업을 가져야 한다는 아버지의 말에 따라 새로 입학한 교육기관의 명칭은?,5585,2
3079,빌럼 왕세자(훗날 빌럼2세)의 아버지가 살고있던 나라는?,40185,2
3080,알루미늄 합금 차체는 어떤 부분에서 약점을 보이는가?,27473,1
3081,정부가 강제로 이주시킨 대상은?,59985,21
3082,라세레나의 별칭은 무엇인가?,11132,21
3083,기존의 성능보다 업그레이드 된 하이퍼카드를 구현하도록 만들어진 언어는?,12537,1
3084,진국이 확실한 형태의 국가가 아니라고 해석했던 인물은?,10086,5
3085,Israels가 초반에 몰두하여 그린 그림의 종류는?,47310,1
3086,문정왕후가 친형제들의 싸움에서 편을 들어주지 않은 인물은?,6999,21
3087,책 《예언이 빗나갈 때》에서 컬트 집단이 주장한 멸망의 날은 언제인가?,6122,2
3088,국방군 무오설에서 독일 국방군과 유사하다고 주장했던 군대는?,43302,1
3089,AMBAC 성능이 저하된 증가장갑의 부위는?,15169,1
3090,데니소바 동굴에서 발견된 화석은 인류의 어떤 종과 유사했나요?,32428,1
3091,도미니카 공화국에 허리케인경보가 약 하루정도 유지되었을 당시 앨런이 위치했던 바다는?,29981,1
3092,그리스 화가의 기록에 대한 도전이 나타나는 작품은?,47372,1
3093,대적광전 주변에 세워진 탑 중 기단이 한 층만 있는 탑은 무엇인가?,34451,2
3094,처음 듀이가 헤드라인을 달성할때 기소한 인물이름은?,22801,1
3095,멀티플레이 종류 중 녹스의 꽃의 구체적 명칭은?,20164,1
3096,치료 시작시기나 치료 전 발작 횟수가 결과를 미치는 것은?,24810,1
3097,숙종의 꿈 속에 나온 사람은 누구를 언급했나?,15654,3
3098,서방 교회의 분열을 종결시킨 사람은?,47447,1
3099,크세르크세스 1세의 두 번쨰 침공이 실패한 원인이 된 전투는?,45614,3
3100,모브의 동생에게 초능력이 생기는 계기가 된 인물은?,49856,2
3101,브리튼이라는 이름이 처음으로 나타난 곳은 어디인가?,4702,8
3102,1974년에 FIFA 월드컵이 열린 나라는?,27365,6
3103,카스가는 복역 기간은?,55133,1
3104,초대 교회에서 성당 중앙에 놓았던 것은?,58780,21
3105,고갱의 표현주의적 특징을 표현주의 화가들이 발전시킨 시기는?,4918,2
3106,아이오와 주는 미국 내 옥수수 재배량의 대략 얼마를 점유하는가?,6216,2
3107,독립운동 중 감옥에 수감되었으며 고문의 후유증으로 사망한 인물은?,53731,5
3108,제임스 보이가 격리된 것은 무엇 때문인가?,28091,21
3109,1954년 월드시리즈 우승 팀은?,23475,21
3110,갈리아인들이 왕으로 추대한 사람은?,4893,21
3111,"스트라빈스키가 ""스위스 시계 장인""이라고 칭한 인물이 사망한 해는?",5052,2
3112,"팔꿈치에 생긴 구획 증후군을 빨리 치료하지 않을 시, 쓸 수 없게 되는 신체 조직은?",56126,1
3113,양희가 찬사를 보낸 이는?,42194,1
3114,시집 《하늘과 바람과 별과 시》를 출간한 사람은?,50571,1
3115,통일된 조지아 왕국의 초대 왕은 누구인가?,26445,9
3116,시라토리가 군사재판에 회부된 죄목은?,18559,21
3117,리스 옐친이 비평한 헌법은 어디에 근거하고있나요?,55723,2
3118,싯다르타가 부처에 의해 깨달음을 얻은 후에 헤어진 인물은?,9292,1
3119,베이역이 운행을 시작한 해는 언제인가?,23108,21
3120,마오쩌둥 사상에서 다른 사상으로 바꾼 사람들은 어느 나라 사람인가?,46555,5
3121,워싱턴-스펜서 토지 허용의 재측량을 지시한 도시는?,26114,1
3122,베토벤의 절친이 작품 출간을 위해 부가한 별칭은?,7870,2
3123,도쿄 내 모든 대학교 중 가큐슈인 본 캠퍼스에만 있는 시설은?,10739,1
3124,"청소년 유해 매체물로 평가될 시, 방송될 수 없는 시간은?",14055,1
3125,정부가 한국거래소를 어디로 이전시키면서 서울의 금융지구 순위가 하락하였나?,53065,1
3126,아킬레 라티가 종교 문제로 목숨을 잃어도 가고 싶어 했던 나라는?,6777,2
3127,세포 성분과 아크릴 아마이드의 결합을 위해 첨가되는 것은?,43997,1
3128,디그 더그를 움직이는데 필요한 도구는?,31959,2
3129,일행들과 함께 션 크러셔를 훔칠 수 있게 퀴 쥬스를 설득한 인물은?,43857,1
3130,보나보가 제국주의에 대항할수 있는 진정한 힘이라 일컬은 것은?,33435,17
3131,허긴스가 신시내티 샴록스에서 사용한 가짜 이름은 무엇인가요?,42331,1
3132,가인지경영에 따르면 인재 경영은 무엇으로부터 시작되나?,48379,3
3133,처음으로 대통령이 탄핵안이 의결 되었을 당시 이를 반대하던 당은?,4768,2
3134,단종이 사약을 받았다는 결정적 증거가 기록된 책은?,5116,2
3135,신시내티에서 노면전차의 승객 수를 감소시킨 교통 수단은?,26579,7
3136,알바니아가 오스만에 정복당한 이후 아르버레셔인들이 여러 번의 이주를 거쳐 최종적으로 자리를 잡은 곳은?,46770,1
3137,"자주 국방 가능 국가가 독자적으로 갖추어야 할 GPS나 정보, 정찰자산 같은 자산은?",60603,1
3138,하나의 요소로부터 만들어져 실패모양인 공추류의 뼈는?,8481,2
3139,모리스가 처음으로 특정 당파에 속하게 된 연도는?,48765,21
3140,래깅에 강경한 입장을 보인 기관의 결정에 동의한 인물은?,58899,1
3141,이중창은 언제를 대비한 것인가?,13020,21
3142,데모스테네스가 투항한 세력은?,45964,4
3143,빌 클린턴이 처음으로 선거에서 패배한 연도는?,4629,6
3144,1941년 특설부대에 체포된 항일연군 여자전사는 몇 명인가?,10944,1
3145,크누트를 자연으로 돌려보내자고 주장한 사람은?,13657,1
3146,경성콤그룹의 핵심 인물은?,15757,5
3147,음형이 A나 B를 벗어나 독자적으로 흘러가는 부분은 몇 마디인가?,43992,1
3148,그리스 정부에 올림픽의 재건과 관련한 문서를 보낸 인물은?,25641,1
3149,3.1운동이 평화적 선언서 낭독으로 한국의 독립을 알리자는 의도가 감정적 시위로 변질됐다고 말한 사람은?,5307,2
3150,아이챌린지 율동놀이 세미나'에서 율동놀이 이외에도 교육받을 수 있는 것은?,44003,1
3151,사람들이 sns 해시태그에 오빠딸을 태그하고 누구의 사진을 함께 게시하는가?,51244,2
3152,예르마가 처음 공개된 곳은 어디인가?,60185,1
3153,회고록을 통해 주장한 내용은 몇년도에 부정되었는가?,51154,21
3154,인간에게 심각한 다양한 질병을 초래하는 아레나바이러스의 종의 수는?,57970,1
3155,제임스 1세의 국적은?,6169,21
3156,<조선공로자명감>을 작성한 기관은?,16131,21
3157,카스티요가 비난한 사람은?,12053,1
3158,여운형은 누구와 함께 일본으로 갔나요?,5590,4
3159,윤치호가 병으로 인해 쓰러지는 모습을 목도한 사람은 누구인가요?,5333,2
3160,폴리포니는 누가 남긴 것인가?,4820,21
3161,비트겐슈타인이 병원에서 봉사를 할 수 있도록 한 인물의 직업은?,4936,2
3162,클레멘스 2세가 교황이 되기 전의 행보에 대해 지적한 교황청의 세력은?,6736,7
3163,시민파빌리온이 위치한 도시는?,24984,21
3164,에두아르도 드 필리포의 사망일은?,59635,1
3165,김용식이 맨 처음 활동했던 곳은?,28258,1
3166,선 레코드에 의해 프레슬리 음반은 얼마에 팔렸는가?,50097,1
3167,사림 세력 제거를 모의했으며 이황과 뜻이 일치했던 세력은?,32443,7
3168,정부가 전후복구재건 사업을 시작된 후에 생긴 기구는 무엇인가?,51213,1
3169,연꽃을 표현한 문양과 함께 광배에서 볼 수 있는 또 다른 문양은?,35378,3
3170,이고르 댜틀로프가 이끄는 모임에서 가장 먼저 빠진 사람은?-,35158,1
3171,알렌이 사람들을 잠들게 하기 위해 사용한 것은 무엇인가?,52574,21
3172,여름철 열사병을 막기 위해 대한민국 군대는 언제 오후 일정을 시행하는가?,16272,4
3173,다양한 지역에 거주하면서 전국 각지에서 살인을 저지른 인물은?,51228,8
3174,고블린 이전에 케잔을 다스리던 종족은?,21928,1
3175,미군정의 미곡정책에 대한 반발로 일어난 사건을 일으킨 집단은?,20985,1
3176,내전에 외국의 간섭이 금지된 것은 언제인가?,42165,18
3177,그레고리오를 라테라노 궁전에 감금한 사람은?,6716,2
3178,미네소타대학의 식품공학과가 개발한 것은?,20743,1
3179,게오르크 프리드리히가 헝기리왕에게 오폴레 지역의 통치권을 넘긴해는?,40346,1
3180,고종의 진보적 정책을 다른 사람이 한 것으로 왜곡한 책은 언제 발행되었나?,15157,1
3181,우르바노 5세가 이태리 전역에 십자군 원정을 명령한 해는?,6773,2
3182,잭슨이 생애 첫 전투를 치른 해는?,36548,8
3183,아르군의 아들이 자랐던 곳은?,16597,1
3184,요리요시가 무쓰노카미로서의 기한이 끝난 시기는?,28779,2
3185,도이 류이치는 무엇에 사인했다는 것이 들켜 민주당을 떠나게 되었는가?,40491,3
3186,오리지널 약품과 같은 성분의 제네릭 의약품은 무엇을 완료한 이후로 개발 가능한가?,42277,1
3187,진왕 정의 말을 전해 들은 후 제왕 건은 어떤 행동을 취할 것이라고 다짐하였나?,5873,4
3188,이규완이 김학우를 죽인 사람이라고 지목한 인물은?,9918,1
3189,양산군 하북면 삼수리에 터전을 잡고 양산 이씨의 시조가 된 사람은?,44856,1
3190,펨토의 전생은 누구인가?,57595,18
3191,<내 어머니 사는 나라>의 작가가 직접 방문했던 곳은?,55682,1
3192,2020년 직권남용으로 인해 2년형을 선고받았던 사람의 직위는 무엇이었나요?,17792,1
3193,미디어법 가결선포 권한쟁의를 발생시킨 측은?,29672,1
3194,황녹색의 유약이 있는 겉부분이 없어지면 무슨색을 띄는가?,38256,1
3195,인류의 발전과 혼란의 원인을 제공한 주체는?,27414,21
3196,교황 갈리스토2세가 종교회의를 개최한 도시는?,34819,1
3197,김구가 안공근에게 야단쳤던 내용이 담긴 책은?,27570,1
3198,기혼 남성들이 사용하던 망건은 신체 어느 부위에 착용하는 것인가?,19259,2
3199,반도가극단과 더불어 시대극을 조선어로 연극하는 단체는?,24749,1
3200,파비아 대학교에 일반 대학의 지위를 부여한 인물의 직업은?,6772,2
3201,혁마르파는 무엇을 통해 중핵파와 해방파의 지도자들을 죽였는가?,57521,1
3202,헨드릭스는 어디로 휴가를 갔다가 뇌졸중을 앓았나요?,20117,1
3203,스텝 기후와 사막 지형이 동시에 나타나는 곳은?,55652,4
3204,페라타 제6군단은 기원전 41년에 누구와 동방에 있었나요?,59061,1
3205,네팔의 헌법 수립안 투표에서 기권한 사람의 수는?,47169,1
3206,이슈타르가 다시 부활한 탐무즈와 함께 머무를 수 있는 계절은?,13012,1
3207,<무정>을 기획한 인물이 태어난 도시는?,11768,21
3208,실존하는 발광체로 만들 수 있는 색깔을 의미하는 단어는?,56639,21
3209,아서 케이스가 조작에 있어서 큰 역할을 했다고 판단한 인물은?,28421,1
3210,장춘단 터가 공원으로 바뀐 해는?,15023,21
3211,상대론에서 운동에너지와 전체에너지의 합은 무엇에 비례하나?,7108,4
3212,초신성이 폭발할 때 충격파에 의해 압축되거나 열을 받는 것은 무엇인가?,16333,1
3213,블레인이 연방 상원으로 선발되기 전까지 맡은 보직이 끝난 해는?,40738,1
3214,더우징퉁의 출생 날짜는?,8731,2
3215,"북한의 작은 목선이 삼척항에 입항했던 날, 대책 회의가 시작된 장소는?",54180,1
3216,1950년대 항생제과다사용 원인은 미생물이 항생제에 무엇을 가지게 되어서인가?,45947,4
3217,장면의 깡패 및 혁신세력 소탕 추진 계획을 수포로 돌린 사건은?,6972,2
3218,춘추 전국 시대에 널리 쓰였던 화폐는?,15883,1
3219,에드워드 3세가 프랑스에서 철수한 것은 무엇 때문인가?,9059,21
3220,"브리오니 협정에 따르면, 슬로베니아는 독립 선포 후 얼마동안 독립 활동을 멈춰야 하는가?",52583,2
3221,510년 민주정을 성립한 나라와 전쟁에서 충돌하였던 조직은?,21267,1
3222,요셉하이든이 자신의 모든 교향곡을 작성하기까지 얼마나 걸렸는가?,5395,3
3223,아미달라 여왕이 팰퍼틴과 손잡고 견제하고자 한 대상은?,13662,1
3224,지방자치단체를 분석한 최초의 보고서는?,56414,21
3225,주찬의 굴복을 받은 사람은?,50310,16
3226,박종철이 검찰총장직에서 물러나는데 결정적 역할을 한 제도는?,46697,1
3227,나이지리아에서 민주주의의 날이 처음 생긴 년도는?,19572,1
3228,후한에서 사마씨 가문과 함께 명성을 날린 집안은?,16645,1
3229,2차 국공 합작 이후 국민당이 설립한 기관은?,14122,7
3230,"""이와나미 문화인""과 이미지적으로 친화성이 있는 인물의 이름은?",58072,1
3231,옻칠의 종류 중 유일하게 물질의 산화를 막기위해 칠하는 것은?,19687,4
3232,1175년에 많은 인부들이 고용되었던 곳은?,7305,3
3233,후아나의 남편은 어디 출신인가?,28753,2
3234,모터헤드에서 베이스와 보컬을 동시에 맡고 있는 사람은?,55765,1
3235,아르타크세르크세스를 독으로 살해한 인물은 누구인가?,45731,7
3236,영지대사가 절을 재건하기 전 절의 명칭은?,15567,17
3237,승표 부부에 대해 적혀있는 명문은 무엇으로 쓰여진 것인가?,47334,1
3238,피해자의 왕따 문제를 회피한 사람은 누구인가요?,30359,1
3239,수천명의 원군이 전투력 강화를 위해 퀘벡으로 파견된 해는?,34715,1
3240,경성제국대학과 홋카이도제국대학의 예과 수업연한이 동일해진 것은 몇 년인가?,8564,2
3241,"잉글랜드에게서 돈과 물품, 군인들을 전달할 수 있었던 것은 무엇을 차지했기 때문인가?",16973,21
3242,두영에게 형양을 지키도록 명령한 인물은 누구인가요?,40922,3
3243,2013년 올레나 소콜로브스키가 출장할 수 없게 된 이유는?,19336,1
3244,행복한 왕자 동상이 도움을 요청한 동물은?,30483,1
3245,빈딘성에서 가장 높은 지역은 어디인가?,22866,1
3246,베이컨이 발표한 부정적인 원리 중 언어와 관련된 원리는?,6642,2
3247,소련군은 언제부터 핀란드 내륙으로 진격하였는가?,4883,21
3248,이슬람교와 힌두교를 혼합해서 새로운 종교를 만든 사람은?,7102,2
3249,김용석이 행정소송에 도입돼야 한다고 한 제도는?,49628,1
3250,세계 최초로 능동방어시스템 고안에 앞장선 국가는?,7861,2
3251,제25회 선거에서 중증장애인이 아닌 당선자가 뽑힌 이후에 소속된 곳은?,54376,21
3252,통일주체국민회의의 구성을 명시한 법은?,6306,3
3253,프로메테우스에게 고통을 주기 위해 보낸 동물은?,4901,21
3254,펑후섬의 강한 바람 때문에 붙여진 이름은?,8945,2
3255,모라꼿으로 인해 14억 달러의 손해를 본 국가는?,21740,3
3256,도조 히데키는 누구의 사망 이후에 비황도파의 중심 인물이 되었나요?,20027,1
3257,법주사에서 동쪽으로 약 6km 지점에 위치한 봉우리의 현재 명칭은?,5463,5
3258,크라우드 펀딩 기술을 통해 뉴스를 제작하는 방식을 국내에 도입한 회사는?,39306,1
3259,쓰치야 히로시가 우수 선수상을 받은 해는?,54817,21
3260,과거 내무성이 담당하던 토목 업무를 현재 담당하고 있는 기관은?,11000,1
3261,마르카리안이 유소년기의 대부분을 살았던 나라는?,39857,2
3262,뮈라가 축출하려한 사람은?,15815,1
3263,황금방울새가 등장하는 소설의 작가는?,58924,1
3264,해적의 공격으로 인해 다른 무역로를 찾으려 했던 국가는?,6488,2
3265,호라티우스가 깊은 우정관계라고 생각한 인물은?,4917,2
3266,옐친 대통령이 의회를 해산하는 계기를 만들었던 집단은?,55723,1
3267,북대서양의 해류는 어느 지역의 해류와 유사한가?,9713,1
3268,글의 의미를 이해하여 표현하는 방법은 무엇인가요?,28963,21
3269,프리츠는 노예들에게 돼지를 놓아준 범인이 나오지 않으면 노예들의 무엇을 뽑겠다고 했나?,55151,1
3270,인공 조명이 등장하기 전 광공해를 일으킨 것은?,20995,1
3271,피에가 유니버시아드 대신 참가한 대회에서 준결승 상대는?,59322,1
3272,루르카작전의 해상함들은 그디냐에서 어디로 이동하였나요?,37060,1
3273,홍준표 후보는 소양강과 함께 어떤 것을 사례로 들며 녹조가 생기는 이유를 설명하였나?,46311,1
3274,히브리 성서에서 그리스도를 뭐라 표현했는가?,6360,1
3275,장면은 아이젠하워에게 새정부의 핵심정책은 무엇이 될 거라고 했나?,6940,2
3276,벨라사리우스에게 군권을 위임해 이탈리아 정복을 지시한 사람은?,55604,3
3277,달인을 절친으로 만들면 이득을 보는 등급은?,39117,1
3278,팔라제국에서 황제들이 신봉한 종교 외에 인정한 종교는?,35232,1
3279,델핀이 젊은 남자와 같이 녹색 광선을 본 곳은?,31988,1
3280,응고되어 있는 코코넛 오일이 녹기 시작하는 온도는?,56201,21
3281,2007년 에리트레아의 자유 지수를 하위 3등이라고 평가한 기관은?,16593,1
3282,틀라스가 지나 롤로브리지다를 위해 공격하지 않은 대상은?,48898,1
3283,슈트레제만에 대한 여론이 부정적으로 바뀌기 시작한 시기는?,18821,2
3284,콘스탄티노폴리스 총대주교에게 치명타를 안겨준 칙령을 내린 사람은?,6703,2
3285,오류가 많은 게임이라는 낙인이 찍힐 수밖에 없었던 당시 상황은?,13738,2
3286,불리한 정보를 배제하는 이유에 대해 말한 사람은?,44682,2
3287,유일하게 항원대변이가 발생하는 바이러스 유형은 무엇인가?,57877,1
3288,이안 스틸이 군에 최적화된 수로라고 말한 호수는?,34592,1
3289,갈리폴리 전투를 승리로 이끈 인물은?,44920,1
3290,1754년에 식민지 쟁탈전에서 승기를 잡은 국가는?,17823,6
3291,개미가 자신의 목적지를 찾기 위해 보는 것은?,49363,3
3292,이교주 어머니의 성씨는?,40064,18
3293,네루다가 사망할 당시 군사혁명을 일으킨 사람의 이름은?,12716,1
