query_id,question,correct_document_id,rank
1804,빙 거리화 정리는 증명 도중에 어떤 공간을 사용하여 증명하는가?,20508,1
1805,고고학자들은 어떤 상황일 때 원어를 활용해 원문을 복원하려고 하는가?,5661,3
1806,석진형이 이사로 있던 음식업체의 이름은?,11638,21
1807,남지기로회도는 무엇을 베낀 작품인가?,19582,1
1808,외골격으로 이루어진 곤충의 기관은?,5374,2
1809,엔베르 호자가 비판했지만 호자주의와 아주 세밀한 차이만 있는 사상은?,46554,1
1810,카탈리나의 부관 중 카탈리나의 약혼자와 동기인 인물은 누구인가?,15835,1
1811,파진 밀사이디는 결혼 전 어떤 직업을 가지고 있었나?,52958,1
1812,3월 14일 입법원에 의해 2차 독회를 통과한 법안은 무엇인가요?,46526,1
1813,조엽수림대와 온도가 비슷한 지역은?,53572,1
1814,임시찬성건의소의 설립과 재무 관련 정보에 관한 보도를 한 언론은?,15113,1
1815,뉴욕 주지사의 지위를 놓고 듀이와 겨루었던 사람은?,22802,6
1816,도천사지 내에서 발견되는 와편은 어느 나라 때 만들어진 것인가?,49737,21
1817,천궁도 점성술이 처음 생겼다고 하는 국가는?,35035,1
1818,하니가 한중가요제에 참여한 연도는?,35342,1
1819,이번에 상영하는 영화에서 유일하게 모자를 쓰고 등장하는 인물은?,40637,1
1820,퍼거슨 시의 무력 시위에 대응하기 위해 경찰이 사용한 물건은?,38754,1
1821,컴퓨터 지식으로 범법행위를 하는 사람은?,5363,3
1822,민족문학작가회의 소속 소설가들이 시위에 참가한 장소는?,7753,2
1823,김영달의 가족이 만주로 이사간 해는?,16871,1
1824,무굴 제국의 전성기를 이끌었으나 동시에 라지프트 제후의 지지를 잃은 사람은?,13969,1
1825,블록체인에 의해 새로이 만들어지고 있는 체계 중 가장 큰 범위를 차지하는 것은?,55294,12
1826,로마로 진군하려한 인물은?,57881,21
1827,아내의 결혼 소식을 듣고 분노에 빠진 인물은?,60322,1
1828,B형 항성보다 비이형 별의 스펙트럼에서 더욱 뚜렷하게 나타나는 현상은?,15171,1
1829,가짜 드미트리가 1년이 넘게 공격해도 함락시킬 수 없었던 곳은?,17318,1
1830,반토가 평상시에 맡고 있는 직책은?,59458,21
1831,사리사에 취약했던 병종은?,10834,7
1832,처칠이 독일 해군의 암호책을 해독하기 위해 보낸 곳의 이름은?,9010,2
1833,량쓰청 부부의 의견을 거절하고 중국 당국이 만든 것은?,39963,1
1834,금식을 철저히 지키면 궁극적으로 가는곳은?,7139,2
1835,요아힘 프리드리히의 친할아버지 이름은?,27840,1
1836,산업혁명이 처음 시작된 나라는?,59785,21
1837,통행증을 사는 것으로 무역 금지령을 피하고자 한 이들은 어느 나라 상인들인가?,29079,1
1838,사도세자가 거짓말까지 해가며 즐긴 것은?,7938,21
1839,동일한 동물령 몇 가지를 모으면 모드를 플레이할 수 있는 시간이 늘어나는가?,53456,1
1840,사전처분에도 불구하고 양육 부모가 비양육 부모에게 아이를 보여주지 않을 때 위반 행위자에게 1천만원 이하의 과태료를 부과할 수 있는 제도는?,33393,1
1841,줏키의 이름을 작명한 사람은 누구인가?,41520,10
1842,경기용 탄환 표면 코팅을 구리 대신 윤활재로 하는 이유는?,10753,1
1843,시작형 거대 모빌아머를 파괴한 것은?,7833,2
1844,경성제국대학에 1년동안 내는 비용이 이공학부 개설 이후 얼마로 변경되었나?,8564,2
1845,순서수와 다르게 정렬 전순서 집합 외에도 존재가 가능한 것은?,6821,2
1846,고샤마인 봉기로 인해 일본은 어느 지역을 획득했는가?,14467,1
1847,새만금호에서 서식하는 어류의 종이 줄어든 가장 큰 이유는 무엇인가?,5963,2
1848,트리노반테스족에 영향을 주기 위해 이행된 일은?,49409,1
1849,크리스티안 로젠크로이츠가 열여섯 살 때까지 머물렀던 장소는?,16022,1
1850,서울중앙지검이 정윤회 씨의 국정 개입을 허위사실로 결론 지은 날짜는 언제였나요?,33560,1
1851,폭탄을 국내로 몰래 가져온 단체는?,9685,1
1852,스티븐 클라크슨의 전 아내의 현 남편은 누구인가?,59672,1
1853,방초정 근처에 위치하며 마을의 구정물을 정화하는 곳은?,51546,1
1854,민수기 마지막 부분에서 여호와의 인도로 계획한 것들을 성공으로 이끄는 인물은?,5257,2
1855,전통 건축 기술을 소멸 위기로 만든 기술은?,54192,1
1856,이범철이 의병활동을 저지하기 위해 파견된 곳은?,11667,1
1857,아르보레아 주디카토국의 마지막 왕은?,45333,1
1858,덴마크에서 독립한 후 노르웨이에서 만들어진 새로운 표준어는?,5833,2
1859,아리타 슈조가 컴백상을 수상하는 맹활약을 보인 해는?,51293,1
1860,1902년에서 1904년 사이에 어떤 이유로 서울에 전화를 50여 대밖에 설치하지 못하였나?,17132,1
1861,자본주의는 내부로부터 붕괴할 것이라고 본 사람은?,20514,1
1862,제2차 인도차이나 전쟁이 끝났던 해는?,8190,19
1863,모아이는 무엇으로 이루어져있나?,6653,5
1864,식품이 오염되게 하는 것은?,7468,2
1865,여공이 다시 자리에 올랐다는 사실을 늦게 알게 된 나라는?,25922,2
1866,성벽 대규모 사업을 벌인 인물은?,5875,19
1867,세포이 항쟁은 언제 일어났나?,22530,1
1868,미국 최고 미술학교가 위치하는 곳의 구체적인 명칭은?,10511,2
1869,페레스베트와 부딪힌 전함의 이름은?,48974,3
1870,테아 레오니의 작중 이름은?,28434,1
1871,태국인 요리사의 도움으로 도피생활을 시작했던 그룹은?,33784,1
1872,가이아가 복수를 하기 위해 만든 것은?,10019,1
1873,화학 반응 발생 시 스스로는 무변하지만 반응 속도에는 변화를 일으키는 것은?,42576,1
1874,하등 척추동물과 비교했을 때 신장의 재생능력이 한정적인 동물 종은?,58285,1
1875,기형이 자동 소멸되어 진화에는 영향을 끼치지 않는다고 주장한 학파는?,33417,1
1876,데니를 조선 정부에 소개해준 인물은 누구인가요?,5157,8
1877,선언형 프로그램의 알고리즘에 대한 정의와 반대인 개념은?,8428,2
1878,조이가 반한 사람은 누구의 동생인가?,14268,4
1879,진함이 진탕에게 뇌물을 상납한 뒤 얻게 된 직위는?,56705,1
1880,9호선에서만 운행되는 열차 호수는?,50832,12
1881,캐서린 엘리자베스 로빈스의 남편은 누구인가?,49370,16
1882,한국판 뉴타입의 간행이 폐지된 해는?,6789,4
1883,세포 셧다운을 실행해야하는 단백질은 어디에 있는가?,56843,1
1884,인도 정당의 상징은 누구를 위함인가?,55690,1
1885,장마전선'의 이동에 영향을 미치는 요인은?,58613,1
1886,남한에 정착하기 위해 탈북자가 교육을 받아야 하는 기간은?,7607,2
1887,모진 고문으로 손상된 유진길의 신체 부위는?,39167,1
1888,미국기업이 원하는 작업자는 어떤 언어를 사용하나요?,26225,21
1889,서로의 배움에 개입하는 학습활동은 학습자의 지식과 함께 무엇을 발달시키는가?,20644,1
1890,헨슬로가 케임브리지 대학의 교수로 활동하기 시작한 해는 언제인가요?,27024,1
1891,지하철이 댄포스 역에 정차할 것을 요청한 사람은?,51767,1
1892,신종 덥스텝이 오버그라운드로 되는데 크게 기여한 인물은?,32539,1
1893,클라우제비츠가 군인이 된 것은 누구의 영향인가?,41366,5
1894,조경왕 장의 아들은 누구인가?,30236,1
1895,인간의 불안전한 행위에 의해 일어나는 상황은 무엇의 원인이 되나요?,58484,1
1896,초대 올림픽 월계수 수상자와 비둘기 모양의 연을 날리는 아이들이 같이 달리는 장면이 나온 올림픽은?,49269,1
1897,일본은 어떤 명분으로 미국 군대가 자국에 머물기를 원하는가?,35041,21
1898,사람들이 태풍에 제대로 대비하지 못한 이유는?,30317,1
1899,아테나이의 민주 정치를 파괴한 인물은?,21267,1
1900,드레드노트 악희사건에 동참한 버지니아의 남자 형제는?,27266,1
1901,오티라 터널이 완공된 해는?,27230,2
1902,최고 지휘부 구성원으로 선출된 사람들은 어디 출신인가?,43577,21
1903,소위 천의 여왕으로 불리는 인물이 대륙에 발표한 방책은 무엇인가?,25684,21
1904,서울교육대학교를 상징하는 동물은 무엇인가?,5210,2
1905,아기스 3세가 여러 국가와 함께 대항한 국가의 이름은 무엇인가?,45759,1
1906,미쿠를 다른 세계로 이끈 정체는?,22549,1
1907,농부들이 콩과 옥수수를 돌려짓기하는 이유는 무엇인가?,6216,2
1908,정해성이 불량배들에게 옆구리를 찔려 심한 부상을 입었던 장소는?,25746,1
1909,1880년대에 영국과 프랑스가 공동으로 다스리기로 한 지역은 어디였나요?,5559,3
1910,앤더스 그룹은 시위하는 집단을 피해 누구의 집으로 갔는가?,33784,1
1911,경희궁이 만들어진 시기는?,7788,4
1912,서울시가 뚝섬지구에 돔구장을 지을 계획을 발표한 달은?,44430,1
1913,그리샤 예거가 3권의 자서전을 집필한 기간은?,55131,1
1914,테오티우아칸의 양식 무덤에 묻힌 사람은?,12184,2
1915,키징거 대연정 다음 총선에서 승리한 당은?,39718,1
1916,윤치호의 사망원인은?,5333,21
1917,1975년에 몬트리올에서 개항한 공항은 도심까지 얼마나 걸리나요?,23669,1
1918,한국교원대를 졸업해도 중등학교 교사임용시험의 응시 대상이 안되는 과는?,40570,1
1919,윤영채가옥의 건축 연도가 기록된 기와가 발견된 해는?,38151,21
1920,발리오니는 무엇에 찔려 죽었나?,49378,21
1921,콤바인에 대항할 수 있는 정보를 보내는 인물은?,24721,1
1922,보그가 만든 이메일 서비스는 무엇을 대상으로 만들어졌나?,48010,2
1923,설치 예술가와 건축 디자인 팀이 협력하여 가설한 작품의 이름은?,48096,1
1924,폭클별의 에너지를 이용해 아루마스를 없애버리려고 하는 집단은?,38452,1
1925,수메르인 관련 사료가 발견된 곳은?,7321,7
1926,요한 베르크만스가 사망한 날짜는?,34987,1
1927,대한도서관 설립에 관한 기사를 다룬 언론사는?,5300,2
1928,빙글이 독보적인 위치를 차지할 수 있는 원인은?,35755,21
1929,조지아 서쪽에 가장 처음 살기 시작한 사람들은 어디로 부터 이주해왔나요?,26143,8
1930,산체스가 피츠버그의 가장 아름다운 25인에 선정된 해는?,37237,1
1931,사바나 원칙이 말하는 인간이 치장을 하는 이유는?,53123,1
1932,중앙에 위치하는 아미타여래좌상은 어떤 방식으로 연화좌 위에 앉아있나?,18989,1
1933,문정왕후가 보우를 도대선사로 올릴 당시의 조선 왕은 몇 세에 즉위하였는가?,7001,2
1934,상대적으로 애니메이션의 캐릭터에 맞추는 것이 수월한 사람은?,52489,1
1935,뮌헨 협약을 통해 전쟁을 모면하려고 했던 영국 총리는?,7901,4
1936,한수산 필화 사건 사망자의 직업은 무엇이었는가?,11255,1
1937,성인아이의 개념을 단계적으로 수용했던 국가는?,57873,1
1938,사회성을 기를 수 있는 학습 활동 유형은?,20645,2
1939,북조선의 5대 혁명가극 중 비극적 결말을 맺는 가극은 무엇인가?,9482,1
1940,여성으로 과학분야에서 첫 대학 교수직을 맡은 사람은 어느 나라 사람인가?,48314,2
1941,엔 배어 콜의 맏이는?,19859,21
1942,시간의 흐름에 따라 재판 참가자들의 판결에 영향을 끼치는 것은?,6111,2
1943,진아의 친할머니 이름은?,23673,1
1944,김일성이 회고록을 직접 쓰지 않았다고 증언한 사람은?,8830,2
1945,단순한 안티 바이러스 도구들이 네트워크 트래픽 점검을 통해 찾을 수 있는 것은?,46450,1
1946,무엇이 이슈타르가 사랑한 대상을 죽음에 이르게 했나?,13012,1
1947,피에르 루이지 반대 세력이 지지했던 사람은?,15632,1
1948,벨콜로레 남편의 직업은 무엇인가?,25411,1
1949,기욤 뮈소가 집필하는 소설의 장르는?,24272,2
1950,레지널드 폴의 어머니는 언제 사망하였나요?,36795,1
1951,20세기 초반에 미치류를 나누기 위해 기준이 되었던 골격은 무엇인가?,8489,7
1952,"부녀자가 얼굴을 가리기위해 썻던 것 중, 고려시대에 사용한 것은?",19689,1
1953,"웃거나 화를 낼 때, 순간적으로 깊은 잠에 빠지면서 근육의 힘이 풀리는 현상은?",11891,1
1954,동해와 남해의 경계가 부산 해운대구를 지나도록 정한 기관은?,7032,2
1955,13세의 비르지타와 혼인하여 총 여덟 명의 자녀를 낳은 인물은?,30411,1
1956,노르웨이와 스웨덴의 언어를 섞어 쓰는 지역은?,6299,21
1957,부르주아 지식인을 중국 혁명에 참여시켜야 한다고 주장한 인물은 누구인가?,59965,1
1958,스페인 군과 트웨쉬 인디언 사이의 갈등의 계기가 된 물건은?,50856,1
1959,새로운 공룡 화석이 더이상 생성되지 않기 시작한 시기는 언제부터인가?,4887,6
1960,만경대학생소년궁전이 설립될 때 같이 건설된 것은?,7774,2
1961,오구즈 칸은 누구의 손자인가?,53817,2
1962,1994 아시안 게임 축구 8강전에서 한국의 상대는?,7247,12
1963,고니오가 오스만 제국의 지배에서 벗어난 해는?,26290,1
1964,키라와 카가리 유라 아스하는 어떤 관계인가?,52513,1
1965,검찰 과거사위원회에서 당시 수사 기록을 꺼내 진상조사한 사건 이름은?,6896,3
1966,2000년에 이오를 관측한 탐사선 중 이오가 황과 이산화황으로 덮여있음을 알린 탐사선은 무엇인가?,8262,4
1967,"김석조, 고성모 등에게 자신과 함께 할 것을 권한 사람은?",8829,2
1968,젤라시오 1세가 교황의 권한을 부각하기 위해 주장한 권리는?,6692,2
1969,나인 브릿지 전략에서 러시아의 협력을 이끌어낼 수 있을 것으로 예상되는 분야는 무엇인가?,46352,1
1970,메디치 가문의 몰락 후 토스카나를 넘겨받은 사람은?,7224,2
1971,구유고슬라비아의 6개 공화국이 최종적으로 모두 분리된 것은 몇 년인가?,5563,2
1972,페르시아 원정군이 에레트리아를 무찌를 때 가장 먼저 전쟁을 시작한 지역은?,10765,2
1973,온타리오 주의 부총독이 된 인물은 어디 출신인가요?,47393,1
1974,법적 구속력이 없는 법정은 누가 만들었나요?,58918,1
1975,작클리와 밀담한 적이 있고 병단 내로 식인 괴몰로 변하는 와인을 퍼트린 인물은?,57153,1
1976,테오도라와 재혼하기 전에 미하일 시슈만의 부인은 누구였는가?,36961,2
1977,대륙 회의에서 코시치우슈코가 부여받은 직위는?,21497,3
1978,1961년에 민족일보의 인쇄를 중지시켰던 부처는 어디인가?,6957,2
1979,공연스태프들이 원하는 좌석에 원하는 색깔의 빛을 출력하기 위해 쓰는 도구는?,52151,1
1980,고려후기 전주치소의 위치를 추정한 책은?,48462,1
1981,왕건을 임금으로 예우하는 의식이 치뤄진 곳은?,9420,1
1982,상기 백자입호는 어느 곳에서 주로 쓰였나?,52411,1
1983,"언론, 교육 등에 힘썼던 가톨릭 조직은 언제 활동하였는가?",28300,1
1984,톰이 등대지기로 가게 된 섬의 이름은?,42896,1
1985,현대에 점성술을 하는 사람들이 부정적으로 생각하는 단어는?,35059,5
1986,곤충이 주변 환경과 비슷한 모양을 하는 이유는?,5381,2
1987,미국과 이라크 관리들은 하킴을 누가 죽였다고 보나?,7391,2
1988,사하라 사막에 철도가 놓인 시기는?,6618,2
1989,낙랑군이 설치된 장소에 있었던 국가를 망하게 한 장본인은 누구인가?,5085,15
1990,이정희가 1839년 교우 다섯 명과 함께 죽임을 당한 사실이 기록된 문헌은?,39031,1
1991,이준용은 어떤 처지라서 일본이 그를 우호적으로 받아들였나?,5151,2
1992,북한군이 국군을 기만하기 위해 배치를 바꾼 것은?,25832,21
1993,국회의장 선거에 무소속으로 출마한 사람은?,54262,16
1994,고려시대 매병은 당시에 무엇을 담는 용도로 쓰였나요?,36729,1
1995,해양 생태계에서 가장 많이 볼 수 있는 착생식물은 무엇인가?,51188,1
1996,불경하다는 비난을 받은 인물은 누구인가?,6469,21
1997,맥도날드의 합작회사 중 해운대 해수욕장과 광안리 해수욕장 부근 매장을 담당하는 곳은 어디인가?,45579,1
1998,코코뱅의 상품 가치를 정하는 데 영향을 주는 것은?,30179,2
1999,예허 국주의 자녀가 누르가치에게 보내졌을 때의 자녀의 나이는?,23746,1
2000,서울 올림픽 야구 종목에서 2위를 한 나라는?,27859,21
2001,네팔 의회 의원 중에서 투표를 포기하고 데모를 시작했던 인원은?,47169,1
2002,1977년의 이스라엘 총선거에서 리쿠드당은 어떤 정당과의 경쟁에서 승리하였나?,17036,3
2003,포카혼타스와 결혼한 인물은?,6168,2
2004,프러데리와 마나워단이 수렵 중에 만난 동물은 무엇인가요?,50538,1
2005,아게실라오스의 아버지는 누구인가?,45759,12
2006,이만규가 최초로 선고받은 형벌은?,49578,8
2007,싸움에 대비한 체육을 다룬 교육의 명칭은?,21256,21
2008,영토 확장의 공로를 세운 왕이 즉위한 해는?,58522,21
2009,나치와 이념전을 펼쳤던 소련의 이념은?,7519,2
2010,후지가오카 역을 기점으로 히가시야마 선과 연결된 노선은?,23441,10
2011,<폴아웃 4>의 음악에 대해 긍정적으로 평가한 플랫폼은?,46286,1
2012,제3차 카얀데르 내각이 무너지게 된 계기는?,47262,1
2013,궁전 아래에 위치하던 집에는 몇 칸의 방이 있었는가?,32056,3
2014,카라치올의 모유을 먹은 동물은?,25376,2
2015,김두관의 해고를 반대했던 당은?,8021,2
2016,맥신이 상급 시험을 준비하던 학교는 어디인가요?,32417,1
2017,2019년 3월 정의용 안보실장과 접촉한 것으로 알려진 인물은?,43177,1
2018,주노 탐사선의 소속 국가는?,8268,3
2019,후루카와 광업은 <창업100년사>이라는 간행물에서 광독을 어떤 단어로 바꾸어 표현하였나?,36034,1
2020,백색육에는어느 정도의 미오글로빈 색소가 내재되어있나?,36821,1
2021,타지마할이 완공되기까지 걸린 시간은?,16089,2
2022,정부의 허가없이 여행 금지 국가를 여행시 처벌할 수 있는 조항이 명시되어 있는 법은?,14069,1
2023,티모시 콜레토 다음으로 민유라의 요청을 받아 파트너가 된 사람은?,48922,1
2024,신존은 자신을 어떤 사람이라고 소개했는가?,33805,6
2025,폴리비오스는 필로포이멘이 죽인 스파르타인의 수가 얼마라고 주장했나?,45532,2
2026,가타에에 등장하는 신을 표현한 언어는 무엇인가?,14271,5
2027,"포랭과 로트렉, 도미에의 공통된 성향은?",18472,1
2028,단층은 만들어질 당시의 무엇에 따라 종류가 나뉘나요?,10137,1
2029,로베르에게 도움을 청한 사람은?,55554,15
2030,데메트리오스가 전황을 타개하기 위해 투입했으나 실패한 병력은?,45892,1
2031,인종에 따른 편향을 실험한 나라는?,6124,13
2032,알코올 의존증 환자가 술을 끊을 때 오한을 일으키는 물질은?,17428,1
2033,눈물을 흘리며 정의를 살려달라고 청한 인물은 누구의 친구였나요?,27005,1
2034,프로메테우스의 정의는 누구를 사랑하는 것인가요?,4902,2
2035,북마케도니아의 공통 언어로 마케도니아어가 지정된 해는?,8861,2
2036,사료 비판 중 실시 자체로 위서를 가릴 수 있는 방식은?,22329,1
2037,긍정적인 생각을 부정적인 생각보다 선호하는 경향을 나타내는 용어는?,6115,2
2038,진원향교 통합 당시 장성향교의 소재지는 어디였는가?,40397,1
2039,EU경쟁법의 시행 권리를 가진 기관은?,34733,1
2040,소련이 핀란드와 전쟁을 시작하며 처음 투입한 병력의 수는?,4882,5
2041,계몽 군주인 예카테리나 여제를 찬양하면서도 신하들의 아부나 가식을 풍자했던 송시는 무엇인가?,55625,1
2042,레인보우 킥은 무엇이 무지개와 비슷해 만들어진 명칭인가?,40750,1
2043,니콜라오 2세는 누구의 도움을 받아 갈레리아를 정벌하였나?,6743,4
2044,하인리히가 코냐크 동맹 전쟁에서 도움을 준 인물은 누구에 대항하고 있었나요?,44997,1
2045,조에라트 철광산의 위치는?,22487,1
2046,법원에서 상고 대상이 아닌 사건에 대해 상고를 기각하는 체계는 무엇인가요?,22495,1
2047,사벨이 겔구그와의 전투에서 파괴한 부위는?,8916,4
2048,미국과의 협상에서 핵무기 대량 축소에 합의한 인물은?,20170,21
2049,정치적 무관심이 도움을 주기도 하는 요소는?,17940,21
2050,이무정이 황소의 난에서 공을 세워 임명된 관직은?,31881,1
2051,바리사이 파에게 순교당한 인물이 주교였던 곳은?,10855,1
2052,김정길이 지역주의 제거에 선구하기 전 분위기를 조성한 사람은?,24460,1
2053,솔라리는 어떤 사양을 쓰고있나요?,37260,1
2054,연꽃대좌에 앉아있는 불좌상이 입고 있는 옷은?,45375,19
2055,음식 관리나 조리 과정에서 발생하는 문제로 인해 나타날 수 있는 질병은?,7454,4
2056,몬태나와 와이오밍은 다코타 준주 지역으로 소속되었다가 언제 각각의 준주로 나뉘어졌나?,34396,2
2057,간부 양성 목적으로 설립된 시설의 이름은?,51157,21
2058,2차 세계대전 당시 독일이 루프트바페 본부를 유치한 도시는?,43525,5
2059,자동차 산업에서 세척에 사용하는 재료는?,40152,1
2060,김영희가 배구를 시작했던 도시는?,8982,2
2061,지우 일행은 전룡을 위한 약을 어디서 구했나?,30511,1
2062,쿠바에 살아서 도착한 반군 중 그들을 이끈 인물은 누구인가?,5675,2
2063,아라키돈산의 적정 섭취량은 1일 최대 얼마인가요?,41594,1
2064,1994년에 스페이스 명예의 전당에 오른 디지털 영상 처리 기술은 어떤 용도였나요?,23149,1
2065,학생 지도부 회의 참석자 중 고려대학교를 다니는 사람의 이름은?,22259,3
2066,마르크스는 착취계급이 어떤 계급을 상대로 착취했다고 주장했나요?,33434,1
2067,우간다 국민을 뜻하는 악기는?,22544,2
2068,외교관과 함께 빨리 전쟁으로부터 대피시켜야 했던 사람들은?,49640,1
2069,1988년에 샤리아티는 파진 밀사이디를 만나기 위해 어디로 갔는가?,52958,1
2070,15살 때까지 맥신과 함께 살았던 인물은 어떤 직업을 가지고 있었나요?,32417,1
2071,홍승대는 누구를 대신하여 동학군의 대장을 만나러 갔나요?,36306,1
2072,"카포레토 전투 이후, 아르만도 디아츠에게 직권을 넘겨야 했던 인물은?",9032,2
2073,윌리엄 3세가 보인강 전투에서 승리한 날짜는?,49115,1
2074,해양지각이 맨틀로 돌아가는 과정을 뭐라하는가?,7334,3
2075,박칼린이 <명성황후>를 편곡할 때 어느 나라에 있었는가?,25660,1
2076,에우데르 카마라가 대주교로 활동할 당시 민중 계몽에서 중시했던 요소는?,21026,1
2077,보상제도에 있어 가장 기본이 되는 것은?,46589,1
2078,채상을 만들 때 사용하는 실을 칭하는 이름은?,17740,21
2079,"범용 컴퓨터가 빨라지면서, 디지털 영상 처리 기술은 무엇의 역할을 대신하게 되었나요?",23149,1
2080,불가리아가 공산주의 국가로 전환된 해는?,21525,1
2081,갈리아 키살피나를 이탈리아에 복속시킨 사람은?,4893,2
2082,미국과 달리 이민자 남성과 현지인의 결혼이 가능했던 국가는?,55030,1
2083,환어음에 관한 사항은 무엇을 바탕으로 작성된 것인가?,17178,1
2084,사회주의와 공산주의가 폭력 또는 비폭력을 통해 가지려는 것은 무엇인가?,6965,2
2085,"음향효과 증대, 고전적 화성법 해체, 혁신적 화성 확대를 한 사람의 이름은?",4815,2
2086,왕망은 평제를 황제로 모시려 했을 때 평제의 생모를 어느 곳에서 지내게 하였는가?,50701,1
2087,용가리가 깨어나는데 계기를 제공한 사람은?,8931,1
2088,어리석은 사람 이야기는 어느 나라 이야기인가?,26269,2
2089,로디니아의 일부로 동남극 지역이 존재하던 시기는?,45952,1
2090,여운형이 김구에 의해 몸수색을 지시받은 장소는?,5600,2
2091,다케다 역에서 스룻토 KANSAI 이전에 공용으로 쓰였던 승차카드는?,37260,1
2092,가디너가 비용을 아끼기 위해 참고한 도시는?,22228,1
2093,전투복 미착용을 이유로 견장을 사용하지 않는 사람은?,40244,7
2094,6월 14일에 칼레바는 어디로 향하고 있었나?,57564,21
2095,꼬리가 있는 도롱뇽과 달리 개구리는 분추류에서 갈라져 나왔다고 제시한 사람은?,8486,2
2096,이아손과 글라우케가 결혼한 지역은?,12201,2
2097,필리스 샐러바의 아들이 오하이오주 신시내티로 이주한 해는?,43091,1
2098,미야니치 신문과 TBS가 실시한 여론조사에서 우위를 점한 당은?,11399,1
2099,블루어-댄포스선과 영-유니버시티선이 분리되며 폐쇄된 곳은 어디인가?,23105,2
